{
  "name": "timer-min-accuracy",
  "config": {
    "mode": "words",
    "words": 2,
    "minAcc": "custom",
    "minAccCustom": 90
  },
  "words": [
    [111, 110, 101, 32],
    [116, 119, 111]
  ],
  "commands": [
    {
      "op": "insert",
      "now": 0,
      "data": [120]
    },
    {
      "op": "advance",
      "now": 1000
    }
  ]
}
