{
  "name": "freedom-regression",
  "config": {
    "mode": "words",
    "words": 2,
    "freedomMode": true
  },
  "words": [
    [111, 110, 101, 32],
    [116, 119, 111]
  ],
  "commands": [
    {
      "op": "insert",
      "data": [111, 110, 101, 32],
      "now": 0
    },
    {
      "op": "delete",
      "now": 100,
      "kind": "deleteContentBackward"
    },
    {
      "op": "insert",
      "data": [32],
      "now": 200
    },
    {
      "op": "insert",
      "data": [116, 119, 111],
      "now": 400
    }
  ]
}
