{
  "name": "stop-letter",
  "config": {
    "mode": "words",
    "words": 2,
    "stopOnError": "letter"
  },
  "words": [
    [111, 110, 101, 32],
    [116, 119, 111]
  ],
  "commands": [
    {
      "op": "insert",
      "data": [111, 120],
      "now": 0
    },
    {
      "op": "insert",
      "data": [110, 101, 32, 116, 119, 111],
      "now": 100
    }
  ]
}
